idx,cluster,is_noise,probability,doc_id,period,year,x_2d,y_2d,text_preview
907,8,False,1.0,berkhin_1972,1954–1984,1972,-3.6393,1.1725,§ 2. Ленинский план борьбы за победу социалистической революцииС победой Февральской буржуазно-демократической революции партия большевиков вышла из п
908,17,False,0.9928,berkhin_1972,1954–1984,1972,-1.6614,0.5488,"Большевистская партия поддержала Апрельские тезисы. Попытка некоторых деятелей партии - Каменева, Рыкова и др. - отвергнуть тезисы Ленина, доказать, ч"
909,54,False,0.5321,berkhin_1972,1954–1984,1972,-0.61,-0.5514,"Временное правительство воспользовалось наступлением на фронте для того, чтобы ограничить демократические свободы внутри страны, усилить политику репр"
910,54,False,0.6705,berkhin_1972,1954–1984,1972,-0.4811,-0.3973,Расстрел Временным правительством рабочей мирной демонстрации в Петрограде. 4 июля 1917 г.Особенно быстро назревал революционный подъем в столице. Уже
911,54,False,1.0,berkhin_1972,1954–1984,1972,-0.5582,-0.7229,ЦК большевистской партии пытался удержать рабочих и солдат столицы от преждевременного выступления. Но массы уже вышли на улицу. Поэтому большевики ре
912,54,False,0.6852,berkhin_1972,1954–1984,1972,-0.8853,-0.2858,"После расстрела демонстрации буржуазное правительство в союзе с меньшевистско-эсеровским начало преследовать большевистскую партию, которую именно в э"
913,-1,True,0.0,berkhin_1972,1954–1984,1972,-2.2122,0.5178,"Съезд рассмотрел политический и организационный отчеты ЦК РСДРП (б), с которыми выступили И. в. Сталин и Я. М. Свердлов, обсудил вопросы о политическо"
914,49,False,0.8728,berkhin_1972,1954–1984,1972,-1.4712,-0.3932,"3. Когда и почему большевистская партия вновь выдвинула лозунг «Вся власть Советам!» и что он означал?1. Ко всем трудящимся, ко всем рабочим и солдата"
915,-1,True,0.0,berkhin_1972,1954–1984,1972,-1.4578,0.2108,"Борьбу угнетенных нерусских народов тормозили буржуазнонационалистические организации, возникшие после Февральской революции на Украине, в Белоруссии,"
916,48,False,0.5197,berkhin_1980,1954–1984,1980,-5.7153,1.602,"Собрание рабочих Горьковского станкостроительного завода, посвященное обсуждению обращения коллектива московского завода «Красный пролетарий» о развер"
917,4,False,1.0,kasimenko_1965,1954–1984,1965,0.309,-3.2233,"Польское королевское войско, преследуя повстанцев, успевших переправиться через р. Сулу, перехватило пути отхода. Окруженные устроили в Солонице (под "
918,4,False,1.0,kasimenko_1965,1954–1984,1965,0.314,-3.2568,"Повстанцам удалось разоблачить изменников, и Лобода был казнен. Но положение окруженных оставалось тяжелым: они испытывали недостаток в воде, пище, си"
919,4,False,1.0,kasimenko_1965,1954–1984,1965,0.3165,-3.2337,"Опираясь на своих сторонников, он арестовал Бородавку и казнил его. Это произвело на казаков угнетающее впечатление. Начались кровопролитные бои. Глав"
920,4,False,0.3585,kasimenko_1965,1954–1984,1965,0.3103,-2.9046,"Решив наказать непокорное казачество, польское правительство направило на Украину войско во главе с коронным гетманом Конецпольским. В 1625 г. у Курук"
921,4,False,0.5193,kasimenko_1965,1954–1984,1965,0.3053,-3.2315,Как-то в полночь отряд казаков ворвался в центр вражеского лагеря и уничтожил несколько сот шляхтичей.. Ярко описан этот эпизод в известной поэме Т. г
922,4,False,0.6648,kasimenko_1965,1954–1984,1965,0.2869,-3.248,"Боровицы, где снова начался бой. Долго и храбро сражались казаки в пылающем местечке, но у них кончились боевые запасы и вода. Павлюк и другие руковод"
923,4,False,0.6531,kasimenko_1965,1954–1984,1965,0.281,-3.1993,"Коронный гетман Потоцкий, готовясь к решительному бою, подтягивал новые силы. Из-за Днепра шло значительное подкрепление польскому войску. С ожесточен"
924,4,False,1.0,kasimenko_1965,1954–1984,1965,0.3092,-3.2165,"Поняв, что дальнейшее сопротивление бесполезно, Острянин более чем с тысячей казаков оставил лагерь и, переправившись через Сулу, перешел на территори"
925,4,False,0.8633,kasimenko_1965,1954–1984,1965,0.3142,-3.2382,"Повстанцы, оставшиеся в лагере под Жовниным, избрали гетманом Дмитрия Гуню, отважного и опытного вожака запорожской голытьбы. Под его руководством они"
926,4,False,1.0,kasimenko_1965,1954–1984,1965,0.3408,-3.2185,"Мощная польская артиллерия с высоких укрепленных мест обстреливала казацкий лагерь, однако его защитники свыше месяца оборонялись с такой стойкостью и"
927,4,False,1.0,kasimenko_1965,1954–1984,1965,0.3153,-3.2435,"Коварная польская шляхта, убедившись, что ей не под силу захватить лагерь, не скупилась на призывы к переговорам. В результате этих призывов среди вер"
928,16,False,0.2776,kasimenko_1965,1954–1984,1965,1.3964,0.0685,"Однако, когда они пытались выйти из лагеря, польские жолнеры (солдаты) набрасывались на них и убивали."
929,4,False,0.9342,kasimenko_1965,1954–1984,1965,0.3145,-3.236,"Получив извещение о результатах битвы под Желтыми Водами, коронный гетман Н. Потоцкий отдал приказ об отступлении основных сил на запад. Предав огню К"
930,4,False,0.43,kasimenko_1965,1954–1984,1965,0.3214,-3.0776,"Один из безвестных героев-повстанцев согласился пробраться в лагерь врага, зная, что его ждет там смерть, и ввести в заблуждение польское войско. Вышл"
931,4,False,0.9399,kasimenko_1965,1954–1984,1965,0.2913,-3.212,"Измена татарского хана поставила казаков в тяжелое положение. Польское войско окружило казацкий лагерь с трех сторон, а с четвертой были непроходимые "
932,4,False,0.3585,kasimenko_1965,1954–1984,1965,0.3406,-2.8155,В 1652 г. возникла новая угроза для Украины. Совместно с польской шляхтой на нее готовился напасть и молдавский господарь (правитель) Лупул. Казацкое 
933,4,False,1.0,kasimenko_1965,1954–1984,1965,0.2707,-3.2199,"В польском лагере возникла паника. Стойко оборонялась лишь немецкая наемная пехота, но вскоре враг полностью был разгромлен."
934,4,False,0.7488,kasimenko_1965,1954–1984,1965,0.35,-3.2578,"Последним удалось скрыться в лагере расположенных здесь русских войск. Вскоре Брюховецкий обвинил Сомко и Золотаренко в измене, добился выдачи их и за"
935,47,False,1.0,kasimenko_1965,1954–1984,1965,-0.4509,0.0099,Палий был отправлен в далекую сибирскую ссылку. В 1709 г. Петр I освободил его и возвратил на Украину.
936,4,False,0.3585,kasimenko_1965,1954–1984,1965,0.3077,-2.8347,Экономическое развитие происходило в условиях усиленного закрепощения крестьян и казаков. Рост феодального землевладения и усиление закрепощения крест
937,-1,True,0.0,kasimenko_1965,1954–1984,1965,-0.0589,-0.5348,"Железняка и других руководителей восстания, являвшихся подданными России, вначале приговорили к колесованию. Позже этот приговор был заменен наказание"
938,-1,True,0.0,kasimenko_1965,1954–1984,1965,-0.3705,0.0549,"В 1822 г. помещичьим отрядам удалось схватить Кармалюка. В кандалах, под сильной охраной его направили в тюрьму. Однако на следствии он, выдавая себя "
939,27,False,0.6574,kasimenko_1965,1954–1984,1965,-1.5205,0.3367,"Буржуазно-либеральная группа, хотя и имела в виду отмену крепостного права в России, однако считала, что это должны сделать сами помещики-крепостники "
940,47,False,0.8677,kasimenko_1965,1954–1984,1965,-0.1761,-0.0402,По доносу предателя царские власти разгромили эту организацию. Наиболее жестоко был наказан Шевченко. В обвинительном заключении говорилось: «За бунта
941,47,False,0.8677,kasimenko_1965,1954–1984,1965,-0.1259,-0.001,"Суровое наказание понесли и единомышленники Шевченко по обществу. Гулак был заключен на три года в Шлиссельбург-скую крепость в Петербурге, другие был"
942,-1,True,0.0,kasimenko_1965,1954–1984,1965,0.013,-0.7695,"Царские карательные отряды жестоко расправлялись с восставшими по всей Киевщине. Они беспощадно секли крестьян, многие были арестованы и осуждены царс"
943,-1,True,0.0,kasimenko_1965,1954–1984,1965,-0.9093,0.4258,"По всей стране широко развернулась революционно-демократическая агитация, создавались кружки из передовой интеллигенции. В Харькове (а позже в Киеве) "
944,-1,True,0.0,kasimenko_1965,1954–1984,1965,-0.8784,0.4431,"Большое влияние на подъем революционно-демократической агитации на Украине оказало возвращение Т. г. Шевченко из ссылки, которая не сломила великого р"
945,-1,True,0.0,kasimenko_1965,1954–1984,1965,0.0702,-0.0621,"Хотя Красовский и был переодетым, его опознали, когда он разбрасывал обращение к солдатам. Его приговорили к смертной казни, но в самый последний моме"
946,55,False,1.0,kasimenko_1965,1954–1984,1965,-1.1723,-0.9212,"В ответ на снижение заработной платы, массовые увольнения и репрессии расширяется забастовочное движение. В частности в 1900 г. на Прохоровских рудник"
947,-1,True,0.0,kasimenko_1965,1954–1984,1965,-1.4418,0.2569,Для усиления своего влияния на массы украинская буржуазия создала в 1900 г. так называемую Революционную украинскую партию (РУП). Руководителями ее яв
948,-1,True,0.0,kasimenko_1965,1954–1984,1965,-0.8673,-0.5174,Непосредственным толчком к началу революции были события 9(22) января 1905 г. В этот день по приказу Николая II царские войска расстреляли мирную демо
949,54,False,0.5953,kasimenko_1965,1954–1984,1965,-0.3299,-0.8521,"Большевистская организация Черноморского флота давно уже вела революционную работу среди матросов, готовя их к восстанию. Матросы были осведомлены о т"
950,47,False,0.9778,kasimenko_1965,1954–1984,1965,-0.6247,-0.306,"К середине 1907 г. стало ясно, что у рабочих и крестьян недоставало сил для осуществления задач, ставившихся революцией. В июне 1907 г. царское правит"
951,8,False,1.0,kasimenko_1965,1954–1984,1965,-3.798,1.0274,Глава XIУКРАИНА В ГОДЫ РЕАКЦИИ И НОВОГО РЕВОЛЮЦИОННОГО ПОДЪЕМА (1907 - 1914 гг.)Наступление реакции. Столыпинская земельная политикаПосле поражения ре
952,55,False,1.0,kasimenko_1965,1954–1984,1965,-1.1297,-0.9491,"В следующем, 1911 г. бастовало в три раза больше рабочих, чем в 1910 г. Наиболее крупные забастовки произошли в портовых городах - Одессе, Николаеве, "
953,-1,True,0.0,kasimenko_1965,1954–1984,1965,-0.7992,-0.6885,Огромный взрыв возмущения и революционного протеста вызвало новое кровавое злодеяние царского правительства - расстрел забастовавших рабочих в далекой
954,-1,True,0.0,kasimenko_1965,1954–1984,1965,-1.0304,-0.683,"Дружно и по-боевому выступили рабочие Украины. Киевский комитет РСДРП в своей листовке по поводу Ленского расстрела писал: «Товарищи, кровавый туман с"
955,55,False,0.8449,kasimenko_1965,1954–1984,1965,-1.0718,-1.0417,Однодневные забастовки произошли почти на всех металлургических заводах Донбасса. Особенно крупные забастовки произошли на Сантуровских заводах в Бахм
956,55,False,1.0,kasimenko_1965,1954–1984,1965,-1.1798,-0.9681,Мощная волна рабочего движения поднялась в начале 1913 г. Годовщину «Кровавого воскресенья» и Ленского расстрела рабочий класс Украины отметил массовы
957,-1,True,0.0,kasimenko_1965,1954–1984,1965,-1.9534,0.4171,"Весь буржуазно-помещичий лагерь России, а также подголоски буржуазии - меньшевики, эсеры и буржуазные националисты всячески оправдывали грабительскую "
958,-1,True,0.0,kasimenko_1965,1954–1984,1965,1.0456,-0.9749,"По указанию германского генерального штаба украинские буржуазные националисты проводили антирусскую пропаганду среди солдат-украинцев, которые в ходе "
959,54,False,0.6986,kasimenko_1965,1954–1984,1965,-0.7822,-0.5163,"Под ударами народных революционных масс, руководимых большевиками, монархия Романовых прекратила свое существование. Февральская революция, свалившая "
960,-1,True,0.0,kasimenko_1965,1954–1984,1965,-0.2646,-0.9673,"Но несмотря на это. Центральная рада полностью признавала свою подчиненность Временному правительству, и оба эти бружуазных органа составляли единый к"
961,54,False,0.7748,kasimenko_1965,1954–1984,1965,-0.5905,-0.5852,"Напуганное ростом революционного подъема в стране. Временное правительство, возглавляемое Керенским, решило перейти в наступление, разгромить авангард"
962,54,False,0.5596,kasimenko_1965,1954–1984,1965,-0.8506,-0.6916,"Остро ощущалась нехватка боеприпасов, медикаментов и продовольствия. Наконец гайдамаки, воспользовавшись численным превосходством, ворвались в «Арсена"
963,37,False,1.0,kasimenko_1965,1954–1984,1965,0.043,-1.281,"В это же время началось освобождение советскими войсками той части Донбасса, которая была захвачена белогвардейскими бандами Каледина. Белогвардейцы с"
964,-1,True,0.0,kasimenko_1965,1954–1984,1965,-0.1343,-1.3661,Ленину с просьбой оказать им помощь. Великий вождь социалистической революции тепло принял их. Он обстоятельно расспрашивал о жизни и борьбе шахтеров 
965,-1,True,0.0,kasimenko_1965,1954–1984,1965,0.4382,-1.1073,"Однако, несмотря на стойкое сопротивление советских войск и отрядов рабочих и крестьян, в нашей стране нехватало сил, чтобы остановить врага. Поэтому "
966,37,False,0.7054,kasimenko_1965,1954–1984,1965,0.2644,-1.0522,"Вскоре иностранным интервентам удалось захватить Херсон и Николаев. Всего интервенты высадили в Крыму и на юге Украины около 80 тыс. французских, англ"
967,37,False,0.9399,kasimenko_1965,1954–1984,1965,0.2163,-1.0651,К весне 1919 г. деникинской армии удалось оккупировать почти всю Украину и начать наступление на Москву. В октябре 1919 г. она захватила Орел и прибли
968,37,False,1.0,kasimenko_1965,1954–1984,1965,0.1058,-1.1806,Интервенты и петлюровцы установили на оккупированной территории кровавый режим. За сопротивление оккупантам захватчики сожгли села Лопатинцы и Кирилло
969,13,False,1.0,kasimenko_1965,1954–1984,1965,-2.891,0.445,Великий вождь и учитель трудящихся В. И. Ленин всегда был теснейшим образом связан с рабочими и крестьянами. В апреле 1921 г. В. И. Ленин принял делег
970,8,False,1.0,kasimenko_1965,1954–1984,1965,-3.505,0.7437,"в. И. Ленин подверг острой критике ошибочные взгляды и предложения И. Сталина, который выдвинул проект так называемой «автономизации». Этот проект пре"
971,53,False,1.0,kasimenko_1965,1954–1984,1965,-5.6177,1.8803,Вследствие создания Советского Союза значительно возросла экономическая взаимопомощь между отдельными республиками. Благодаря трудовому героизму совет
972,66,False,1.0,kasimenko_1965,1954–1984,1965,-0.7604,2.8866,Выдающиеся достижения советских людей в борьбе за восстановление народного хозяйства были омрачены глубоким всенародным горем. 21 января 1924 г. умер 
973,-1,True,0.0,kasimenko_1965,1954–1984,1965,-2.317,0.5456,"На этом же съезде каждая делегация в отдельности была ознакомлена с «Письмом съезду» в. И. Ленина, известным под названием завещания в. И. Ленина. В п"
974,6,False,1.0,kasimenko_1965,1954–1984,1965,-3.8896,-1.311,"в. И. Ленин отмечал положительные черты И. Сталина, вместе с тем подверг критике его недостатки. «Тов. Сталин, - писал в. И. Ленин, - сделавшись генсе"
975,64,False,0.7643,kasimenko_1965,1954–1984,1965,-1.4322,1.6841,"Сталин слишком груб, и этот недостаток, вполне терпимый в среде и в общениях между нами, коммунистами, становится нетерпимым в должности генсека. Поэт"
976,-1,True,0.0,kasimenko_1965,1954–1984,1965,-4.3169,1.0897,"Глава XVIБОРЬБА ЗА СОЦИАЛИСТИЧЕСКУЮ И НДУСТР И АЛ ИЗАЦИЮПервые успехи социалистической индустриализацииРуководствуясь ленинскими указаниями, XIV съезд"
977,-1,True,0.0,kasimenko_1965,1954–1984,1965,-2.3928,2.1508,"Упорное сопротивление индустриализации оказывали враги социализма внутри страны, а также их агентура в ВКП(б). Против генеральной линии партии выступи"
978,-1,True,0.0,kasimenko_1965,1954–1984,1965,-1.5544,0.33,Заклятыми врагами политики социалистической индустриализации выступали украинские буржуазные националисты и их агентура в КП (б) У. В этот период в Ко
979,50,False,1.0,kasimenko_1965,1954–1984,1965,-4.7265,1.3987,Возникновение массового социалистического соревнованияВ мае 1929 г. V Всесоюзный съезд Советов утвердил первый пятилетний план развития народного хозя
980,53,False,0.9975,kasimenko_1965,1954–1984,1965,-5.6594,1.9541,Пятилетний план развития Украинской ССР открывал величественные перспективы подъема всего народного хозяйства. За годы пятилетки на Украине намечалось
981,48,False,1.0,kasimenko_1965,1954–1984,1965,-5.8498,1.7159,Принятие первой пятилетки и успехи социалистического строительства вызвали огромный политический и трудовой подъем рабочего класса. Это наиболее ярко 
982,48,False,0.7451,kasimenko_1965,1954–1984,1965,-5.9432,1.6997,"Организатором, вдохновителем и руководителем социалистического соревнования была Коммунистическая партия. Благодаря этому социалистическое соревновани"
