idx,cluster,is_noise,probability,doc_id,period,year,x_2d,y_2d,text_preview
1748,52,False,0.82,barsenkov_2010,2000-2012,2010,1.0322,-1.7298,"ского Союза, включая самые малочисленные. К примеру, среди нанай4 цев и ульчей участники войны составили 8% от их общей численности. Советские войска,"
1749,-1,True,0.0,barsenkov_2010,2000-2012,2010,0.5022,-0.2312,"Перестройка страны на военный лад. Начавшаяся с первых часов вой4 ны, перестройка жизни в стране стала приобретать заметную органи4 зованность с конца"
1750,-1,True,0.0,barsenkov_2010,2000-2012,2010,-1.3287,1.6692,"М. Каганович, а в ноябре 1944 г. - Н. А. Бул4 ганин, сменивший Ворошилова. При образовании ГКО заместителем председателя был назначен Молотов. Однако,"
1751,56,False,0.8285,barsenkov_2010,2000-2012,2010,-5.0339,1.3037,"30 июня 1941 г. Совнарком СССР утвердил общий мобилизацион4 ный народнохозяйственный план, предусматривающий перестройку эко4 номики на военный лад в "
1752,-1,True,0.0,barsenkov_2010,2000-2012,2010,0.8204,2.1,"В феврале 1941 г. НКВД был разделен на два наркомата - НКГБ (в который пере4 шли подразделения госбезопасности) во главе с в.Н. Меркуловым, и НКВД во "
1753,-1,True,0.0,barsenkov_2010,2000-2012,2010,0.7471,2.1036,"В начале войны, 17 июля 1941 г. контрразведка была возвра4 щена в НКВД, а 20 июля НКВД и НКГБ вновь объединены в один НКВД во главе с Бери4 ей. В апре"
1754,41,False,1.0,barsenkov_2010,2000-2012,2010,0.397,-1.7376,"Отдельный пункт директивы требовал «немедленно предавать суду военного трибунала всех тех, кто своим паникерством и трусостью мешает делу обороны, нев"
1755,-1,True,0.0,barsenkov_2010,2000-2012,2010,-2.2388,0.6459,"Сталин, однако, включил в речь ряд новых важных тем, а главное, сумел найти такие слова и такой тон, которые превратили директиву в одну из самых волн"
1756,3,False,1.0,barsenkov_2010,2000-2012,2010,0.7622,4.297,"Сталин, скорее всего, был уже ознакомлен с «Посланием пастырям и пасомым Христовой Православной церкви» Патриаршего Место4 блюстителя, митрополита Мос"
1757,3,False,1.0,barsenkov_2010,2000-2012,2010,0.7039,4.2385,"Вместе с ним она и испытания несла, и утешалась его успеха4 ми. Не оставит она народа своего и теперь. Благословляет она небесным благословением и пре"
1758,-1,True,0.0,barsenkov_2010,2000-2012,2010,-2.5764,0.0003,"Советский народ ведет Отечественную войну против фашистской Герма4 нии. Вопрос идет о разгроме фашизма, поработившего ряд народов и стре4 мящегося пор"
1759,-1,True,0.0,barsenkov_2010,2000-2012,2010,-2.5341,0.1526,"на за свободу нашего отечества», которая «сольется с борьбой народов Европы и Америки за их независимость, за демократические свободы». Он говорил и о"
1760,42,False,1.0,barsenkov_2010,2000-2012,2010,0.5629,-0.005,10 июля 1941 г. Ставка Главного Командования была реорганизована в Ставку Верховного Командования. Вместо Тимошенко ее фактически возглавил Сталин. С 
1761,42,False,0.9814,barsenkov_2010,2000-2012,2010,0.4996,0.1242,"М. Шапошников, признанный военный теоретик, началь4 ник Генерального штаба с июля 1941 г. 8 августа 1941 г. указом Президиума ВС на пост Верховного Гл"
1762,-1,True,0.0,barsenkov_2010,2000-2012,2010,0.4731,0.1528,"Жуков, назначенный в августе 1942 г. первым заместителем наркома обороны и заместителем Верховного Главнокомандующего, позднее вспоминал: «Трудно было"
1763,52,False,0.8008,barsenkov_2010,2000-2012,2010,0.9898,-1.8099,"его слово было окончательным и обжалованию не подлежало». Но, от4 мечал полководец, в начале войны он «плохо разбирался в способах, методике и формах "
1764,40,False,1.0,barsenkov_2010,2000-2012,2010,0.8697,-0.5927,"В 1942 г. в рядах Красной Армии и Флота находилось свыше 2 млн коммунистов, 54,3% всего состава партии; в кон4 це войны - 2,6 млн коммунистов из 6 млн"
1765,-1,True,0.0,barsenkov_2010,2000-2012,2010,0.7085,-1.1748,ных преступлениях расстреляны 30 генералов. 16 августа 1941 г. издан приказ об ответственности военнослужащих за сдачу в плен и оставле4 ние врагу ору
1766,52,False,1.0,barsenkov_2010,2000-2012,2010,0.5767,-2.084,"В ре4 зультате двухмесячного Смоленского сражения (город оставлен 29 июля, бои на востоке от него продолжались до 10 сентября) германский план молниен"
1767,52,False,1.0,barsenkov_2010,2000-2012,2010,0.2252,-2.1232,Самые тяжелые дни для Москвы начались 15 октября. В тот день ГКО принял постановление об эвакуации столицы. На совещании у Сталина командующему Москов
1768,-1,True,0.0,barsenkov_2010,2000-2012,2010,-0.4416,-1.4959,"В ряде случаев они породили беспорядочное бегство административных работ4 ников разного уровня, сожжение архивной документации, грабежи бро4 шенных ма"
1769,-1,True,0.0,barsenkov_2010,2000-2012,2010,0.9351,-1.2982,"Всякое движе4 ние - как отдельных лиц, так и транспорта - запрещалось с 24 ч до 5 ч ут4 ра, нарушители порядка немедленно привлекались к ответственнос"
1770,-1,True,0.0,barsenkov_2010,2000-2012,2010,1.3259,-1.2283,"А. Гарриманом, возглавлявшим делегацию США на московс4 ком совещании представителей СССР, США и Великобритании (29 сен4 тября - 1 октября 1941 г.), Ст"
1771,-1,True,0.0,barsenkov_2010,2000-2012,2010,-2.6391,-1.3052,"Слово «гвардия», появившееся в России еще в петровское время, все4 гда означало самые отборные, боеспособные, отличающиеся особым му4 жеством войска. "
1772,52,False,0.8008,barsenkov_2010,2000-2012,2010,0.941,-1.6192,"ной ненавистью к врагу», что переводило в реальность сталинское пре4 достережение: «Если немцы хотят иметь истребительную войну с наро4 дами СССР, они"
1773,36,False,1.0,barsenkov_2010,2000-2012,2010,-0.4039,-1.7217,"24я ударная армия Волховского фронта, на которую возлагались особые надежды по прорыву блокады, в январе попала в окружение и несла огромные потери. В"
1774,51,False,1.0,barsenkov_2010,2000-2012,2010,2.1131,-1.5383,"В августе 1941 г. Великобритания и США подписали декларацию о целях войны, получившую наименование «Атлантическая хартия». В ней говорилось, что терри"
1775,-1,True,0.0,barsenkov_2010,2000-2012,2010,1.3751,-1.5776,"1 января 1942 г. 26 государств антифашистской коалиции (включая СССР и Китай) подписали декларацию, по которой обязались исполь4 зовать свои военные и"
1776,52,False,1.0,barsenkov_2010,2000-2012,2010,1.0906,-2.1029,"Мне4 ние Шапошникова и Жукова, предлагавших перейти к стратегиче4 ской обороне на период, пока военная промышленность освоит но4 вые образцы вооружени"
1777,40,False,1.0,barsenkov_2010,2000-2012,2010,0.834,-1.018,"использовались на наиболее тяжелых и опасных участках боевых дей4 ствий и несли в 3-6 раз большие потери, чем обычные войска. В 1942 г. в них направле"
1778,52,False,1.0,barsenkov_2010,2000-2012,2010,1.0871,-2.0735,Василевский (начальник Генштаба с июня 1942 г.) докладывали обстановку в городе и вокруг него И. в. Сталину. Когда он начал изу4 чать карту с располож
1779,-1,True,0.0,barsenkov_2010,2000-2012,2010,0.6317,0.7822,Жукову (18 января) и A. M. Василевскому (16 февраля). 6 марта того же года маршальское звание присвоено И. в. Сталину.
1780,-1,True,0.0,barsenkov_2010,2000-2012,2010,1.188,0.4016,"служащих - с 10 до 8 млн, колхозников - с 29 до 23,5 млн. Значитель4 ную часть занятых в экономике составляли женщины. В 1945 г. их было до 60% общей "
1781,-1,True,0.0,barsenkov_2010,2000-2012,2010,-6.1444,1.0396,"Объем работ, трудовых и материальных зат4 рат на них намного превысил аналогичный показатель всей совокупно4 сти гидротехнического строительства предш"
1782,-1,True,0.0,barsenkov_2010,2000-2012,2010,-0.7267,-1.619,Армия была избавлена от участи быть обутой в башмаки и лапти с обмотками. В апреле 1942 г. изобретение кирзы было отмечено Ста4 линской премией. В 194
1783,16,False,0.2745,barsenkov_2010,2000-2012,2010,1.2725,-0.0651,"Одним из факторов победы стала стойкость советских лю4 дей, попавших под оккупацию. На захваченных территориях гитле4 ровцы установили режим, полность"
1784,-1,True,0.0,barsenkov_2010,2000-2012,2010,1.2032,-1.2386,"Обращаясь к немецкому народу утром 22 июня 1941 г., Гит4 лер утверждал, что «никогда немецкий народ не испытывал враждеб4 ных чувств к народам России…"
1785,-1,True,0.0,barsenkov_2010,2000-2012,2010,1.4418,-1.6445,тавить его руководству страны и оказать серьезное влияние на исход войны. Подлинное состояние страны и ее армии хорошо выразил один из попавших в неме
1786,20,False,0.8282,barsenkov_2010,2000-2012,2010,1.288,0.9812,"C. Абакумовым, за период с июля 1941 по май 1946 г. были арестованы около 700 тыс. человек, из них 70 тыс. расстреляны.) Основная масса людей на захва"
1787,51,False,0.9026,barsenkov_2010,2000-2012,2010,2.1776,-1.3,"М. Май4 ский были отозваны из столиц США и Великобритании. О роспуске Коминтерна было объявлено в прессе 15 мая, в самом начале Вашинг4 тонской конфер"
1788,16,False,0.7169,barsenkov_2010,2000-2012,2010,1.633,0.7469,"Особенно Советской России, изначально лишенной возможности какого4либо са4 мостоятельного участия в деятельности международных организаций. Объяснение"
1789,40,False,1.0,barsenkov_2010,2000-2012,2010,0.8767,-0.8265,"10 января 1942 г. было принято решение, предписывающее «всех немцев - мужчин в возрасте от 17 до 50 лет, годных к физическому тру4 ду, выселенных в Но"
1790,-1,True,0.0,barsenkov_2010,2000-2012,2010,-0.5834,0.7835,"Полагают, что начальник Генерального штаба маршал Б. М. Шапошников, открыто рели4 гиозный человек, лично докладывал о письме Сталину и советовал посту"
1791,3,False,1.0,barsenkov_2010,2000-2012,2010,0.7154,4.259,черкивалась тесная связь между русским народом и его церковью. В кон4 це марта в Ульяновске был созван первый за время войны Собор еписко4 пов Русской
1792,3,False,0.9782,barsenkov_2010,2000-2012,2010,0.8006,4.3281,"Демонстрируя меняющееся отношение к церкви, московские влас4 ти в апреле 1942 г. впервые способствовали организации религиозного празднования правосла"
1793,3,False,0.6672,barsenkov_2010,2000-2012,2010,0.7746,4.3025,Открытие банков4 ского счета означало признание Церкви де4факто юридическим лицом. Главные перемены в отношениях между государством и Церковью про4 из
1794,3,False,1.0,barsenkov_2010,2000-2012,2010,0.775,4.3089,12 сентября Собор в составе 19 иерархов (16 из них были доставлены из лагерей и ссылок) избрал митрополита Московского Сергия новым Патриархом Московс
1795,3,False,0.7832,barsenkov_2010,2000-2012,2010,0.7719,4.2942,"8 октября 1943 г. образован Совет по делам Русской православной церкви при СНК ССср. С конца года открываются для службы храмы, растет число православ"
1796,-1,True,0.0,barsenkov_2010,2000-2012,2010,-1.9663,2.3988,31 января 1944 г. Сталин принял личное участие в обсуждении киноповести А. Довженко «Украина в огне» и негодующе заметил: «Если судить о войне по кино
1797,52,False,0.7994,barsenkov_2010,2000-2012,2010,1.0115,-2.0152,В начале июня 1943 г. союзники известили И. в. Сталина о своем решении не открывать второй фронт в Евро4
1798,51,False,0.962,barsenkov_2010,2000-2012,2010,1.9564,-1.7615,"пе в 1943 г. Отношение к этому вопросу изменилось после победы советских войск под Курском. У союзников возникли опасения, что без второго фронта прот"
1799,51,False,1.0,barsenkov_2010,2000-2012,2010,2.2369,-1.7746,"И. в. Сталин заверил союзников, что советские войска предпримут наступление в это время с целью пре4 дотвратить переброску германских войск. В Тегеран"
1800,-1,True,0.0,barsenkov_2010,2000-2012,2010,-0.2577,1.8624,"П. Берии. Первоначально предполагалось использовать для его образования ли4 деров еврейской социалистической партии Польши г. Эрлиха и в. Аль4 тера, а"
1801,-1,True,0.0,barsenkov_2010,2000-2012,2010,-0.2207,1.3096,"Они, как писал П. А. Судоплатов, «слишком много знали о намерениях Сталина воспользоваться ими для выколачивания денег на Западе». В декабре 1941 г. и"
1802,15,False,0.7976,barsenkov_2010,2000-2012,2010,-0.1704,1.4206,"Гольдберг, выходец из России, встре4 чал их. Помимо США, они посетили также Мексику, Канаду и Вели4 кобританию. В Москву делегация вернулась в начале "
1803,16,False,0.2743,barsenkov_2010,2000-2012,2010,1.4029,0.797,"А. Лозовским оно было направлено Маленкову, Щербакову и Возне4 сенскому с поручением рассмотреть этот вопрос. Образование еврейской республики в Крыму"
1804,-1,True,0.0,barsenkov_2010,2000-2012,2010,1.3204,0.7456,"Обосновывая предложение, Берия пи4 сал Сталину: «Учитывая предательские действия крымских татар про4 тив советского народа и исходя из нежелательности"
1805,51,False,0.9026,barsenkov_2010,2000-2012,2010,2.1384,-1.3135,Великая Отечественная война завершилась. 9 мая объявлено в СССР Днем Победы. Вопросы послевоенного устройства мира на конференциях в Ялте и Потсдаме. 
1806,51,False,0.9026,barsenkov_2010,2000-2012,2010,2.267,-1.3354,"Оккупация, к ко4 торой на равных правах с великими державами привлекалась Фран4 ция, предпринималась в целях демилитаризации, денацификации и демократ"
1807,51,False,1.0,barsenkov_2010,2000-2012,2010,2.5656,-1.4408,Острое противоборство по проблемам послевоенного урегулирова4 ния развернулось 17 июля - 2 августа 1945 г. на Берлинской (Потсдам4 ской) конференция г
1808,-1,True,0.0,barsenkov_2010,2000-2012,2010,-3.06,1.5744,"Однако вынуждена была признать, что победу обеспечили не танки и коммунистические доктрины, а прежде всего патриотизм рус4 ского народа. В знаменитом "
1809,-1,True,0.0,barsenkov_2010,2000-2012,2010,1.2428,-1.2198,"Все это стало окраши4 вать послевоенную сталинскую внешнюю, внутреннюю политику и со4 ветский патриотизм в цвета русского национализма и великодержави"
1810,16,False,0.3838,barsenkov_2010,2000-2012,2010,1.3441,0.3755,"0,6 млн составили разные небоевые потери - от болезней, в резуль4 тате происшествий, самоубийств, расстрелов; 5 млн человек пропали без вести и попали"
1811,16,False,0.4803,barsenkov_2010,2000-2012,2010,1.4119,0.3819,"Соотношение между советскими и немецкими безвозвратными по4 терями военнослужащих составляет 1,3:1. На это соотношение во мно4 гом повлиял тот факт, ч"
1812,20,False,0.4824,barsenkov_2010,2000-2012,2010,1.2908,1.0251,"В 1952 г. численность этой эмиграции (в основном не желающих или по4 боявшихся возвратиться в СССР) составила около 620 тыс. человек, из них 140 тыс. "
1813,20,False,0.4318,barsenkov_2010,2000-2012,2010,1.3357,0.9958,"Этот контраст мог стать основой «низкопоклонства перед Западом», распространения которого среди со4 ветских людей очень опасались во властных структур"
1814,16,False,0.321,barsenkov_2010,2000-2012,2010,1.5007,0.6637,"кие татары (0,85%), калмыки (0,6%). (Сравнение этих цифр с удельным весом национальностей в населении страны накануне войны позволяет говорить о более"
1815,40,False,0.9388,barsenkov_2010,2000-2012,2010,0.7855,-0.5124,Созданные в горах мятежные отряды чеченцев при приближении немецких войск установили с ними связь и вели крупные бои в тылу Красной Армии. По законам 
1816,20,False,0.7701,barsenkov_2010,2000-2012,2010,1.3337,1.2207,"Сре4 ди заключенных лагерей и колоний на 1 января 1951 г. числились 335 тыс. «изменников родины», среди спецпоселенцев - 135 тыс. «вла4 совцев» (на 1 "
1817,40,False,1.0,barsenkov_2010,2000-2012,2010,1.0551,-0.6556,С марта 1944 г. развер4 нулись акции НКВД по подавлению отрядов Организации украинских националистов (ОУН) и Украинской повстанческой армии (УПА) на З
1818,16,False,0.7374,barsenkov_2010,2000-2012,2010,1.7131,0.6161,"Трагическим наследием Великой Отечественной войны стала депор4 тация в Казахстан, Сибирь и другие восточные районы населения из ряда национальных реги"
1819,20,False,1.0,barsenkov_2010,2000-2012,2010,1.3091,1.1607,"Среди них оказались около 157 тыс. (6,7%) отозванных из армии представителей «наказанных народов». 7 июля 1945 г. Президиум ВС объявил амнистию в связ"
1820,-1,True,0.0,barsenkov_2010,2000-2012,2010,-0.6296,1.9065,"Толбухин и генерал армии А. И. Антонов, а ге4 нералиссимус И. в. Сталин, маршалы г. К. Жуков и А."
1821,10,False,1.0,barsenkov_2010,2000-2012,2010,-2.8433,3.2458,"г. Музруков, конструктор тяжелых танков Н. Л. Духов, ставшие в ок4 тябре 1949 г. первыми в Советском Союзе дважды Героями Социалис4 тического Труда за"
1822,3,False,0.1139,barsenkov_2010,2000-2012,2010,0.4307,3.8013,"Войно4Ясенецкий) с началом войны телеграфировал М. И. Калинину: «Являясь специалистом по гнойной хирургии, могу ока4 зать помощь воинам в условиях фро"
1823,3,False,1.0,barsenkov_2010,2000-2012,2010,0.7348,4.2655,"Лечение раненых епископ совмещал с ар4 хиерейским служением. В 1943 г. он был назначен управляющим Красно4 ярской епархией, а в феврале 1944 г. переве"
1824,52,False,0.759,barsenkov_2010,2000-2012,2010,1.23,-1.7315,"Вместе с ним на дно пошли свыше 5 тыс. германских сол4 дат и офицеров, в том числе и около 1300 высококвалифицировангных под4 водников для укомплектов"
