idx,cluster,is_noise,probability,doc_id,period,year,x_2d,y_2d,text_preview
0,38,False,0.6069,aleksandrov_1947,1947-1953,1947,-0.438,0.3203,"DjVu БиографияIСталин (Джугашвили), Иосиф Виссарионович, родился 21 декабря 1879 года в городе Гори, Тифлисской губернии. Отец его - Виссарион Иванови"
1,38,False,1.0,aleksandrov_1947,1947-1953,1947,-1.0815,-0.1052,Осенью 1888 года Сталин поступил в Горийское духовное училище. В 1894 году Сталин окончил училище и поступил в том же году в Тифлисскую православную д
2,-1,True,0.0,aleksandrov_1947,1947-1953,1947,-0.8445,-0.8919,Развитие промышленного капитализма сопровождалось ростом рабочего движения. В 90-х годах в Закавказье вели революционную работу сосланные туда русские
3,6,False,0.7775,aleksandrov_1947,1947-1953,1947,-3.6844,-1.2186,"Пятнадцатилетний Сталин становится революционером.«В революционное движение, - говорит Сталин, - я вступил с 15-летнего возраста, когда я связался с п"
4,38,False,1.0,aleksandrov_1947,1947-1953,1947,-1.5497,-0.49,В 1896 - 1897 годах Сталин стоит во главе марксистских кружков семинарии. В августе 1898 года он и формально вступает в Тифлисскую организацию Российс
5,6,False,1.0,aleksandrov_1947,1947-1953,1947,-3.7566,-1.1703,"Сталин много и упорно работает над собой. Он изучает «Капитал» Маркса, «Манифест коммунистической партии» и Другие работы Маркса и Энгельса, знакомитс"
6,18,False,0.8575,aleksandrov_1947,1947-1953,1947,-2.9152,0.1385,"Круг теоретических запросов Сталина чрезвычайно широк - он изучает философию, политическую экономию, историю, естественные науки, читает классиков худ"
7,6,False,1.0,aleksandrov_1947,1947-1953,1947,-3.8753,-1.3369,"Сталин ведет в этот период интенсивную пропагандистскую работу в рабочих кружках, участвует на нелегальных рабочих собраниях, пишет листовки, организу"
8,38,False,1.0,aleksandrov_1947,1947-1953,1947,-1.4088,-0.2479,"В семинарии, где была налажена строгая слежка за «подозрительными», начинают догадываться о нелегальной революционной работе Сталина. 29 мая 1899 года"
9,38,False,1.0,aleksandrov_1947,1947-1953,1947,-1.6675,-0.6588,Уже в то время Сталин - один из самых энергичных и видных работников тифлисской социал-демократической организации. «В период 1898 - 1900 гг. сложилас
10,17,False,1.0,aleksandrov_1947,1947-1953,1947,-1.7064,0.3406,"Новую тактику встречает в штыки оппортунистическое большинство «Месаме-даси», которое склонялось к «экономизму», чуралось революционных методов, было "
11,38,False,1.0,aleksandrov_1947,1947-1953,1947,-1.552,-0.7643,"В переходе тифлисских социал-демократов к новым методам работы выдающуюся роль сыграл Виктор Курнатовский - образованный марксист, стойкий последовате"
12,6,False,1.0,aleksandrov_1947,1947-1953,1947,-3.9072,-1.2805,"Когда с декабря 1900 года начала выходить ленинская «Искра», Сталин целиком стал на ее позиции. Сталин сразу же увидел в Ленине создателя настоящей ма"
13,13,False,0.9595,aleksandrov_1947,1947-1953,1947,-2.85,0.0388,Сталин проникся безграничной верой в ленинский революционный гений и пошел по пути Ленина. Он никогда не сворачивал с этого пути и после смерти Ленина
14,19,False,0.7713,aleksandrov_1947,1947-1953,1947,-1.9783,0.4896,Сталин - организатор и руководитель демонстрации. Эту демонстрацию ленинская «Искра» оценила как событие исторически-знаменательное для всего Кавказа;
15,-1,True,0.0,aleksandrov_1947,1947-1953,1947,-1.5565,-0.8407,Так в эти годы под руководством революционного меньшинства «Месаме-даси» во главе со Сталиным был осуществлен переход рабочего движения Грузии от узко
16,38,False,1.0,aleksandrov_1947,1947-1953,1947,-1.4315,-0.3615,"Встревоженное ростом революционной борьбы закавказского пролетариата, царское правительство усиливает репрессии, рассчитывая этим путем остановить дви"
17,38,False,0.6401,aleksandrov_1947,1947-1953,1947,-1.4062,-0.552,Сатрапы царя были бессильны перед нараставшим революционным движением. С сентября 1901 года по инициативе Сталина и Кецховели стала выходить «Брдзола»
18,18,False,1.0,aleksandrov_1947,1947-1953,1947,-2.3134,0.2354,"Передовая первого номера «Брдзолы» (сентябрь 1901 г.) под названием «От редакции» была написана Сталиным. Определяя задачи газеты, Сталин писал: «Груз"
19,18,False,1.0,aleksandrov_1947,1947-1953,1947,-2.3535,0.3288,"Сталин указывал в передовой, что газета должна возглавлять рабочее движение, стать возможно ближе к рабочей массе, иметь возможность постоянно влиять "
20,-1,True,0.0,aleksandrov_1947,1947-1953,1947,-2.5346,0.547,В следующем номере «Брдзолы» (ноябрь - декабрь 1901 г.) была опубликована важная статья Сталина «Российская социал-демократическая партия и ее ближайш
21,38,False,1.0,aleksandrov_1947,1947-1953,1947,-1.6467,-0.6891,"Широкие размеры принимает и издание листовок на различных языках многонационального Закавказья. «Прекрасно написанные прокламации выходили на русском,"
22,38,False,0.8488,aleksandrov_1947,1947-1953,1947,-1.7157,-0.4884,"В конце ноября, по поручению Тифлисского комитета, Сталин едет в Батум, третий по величине после Баку и Тифлиса пролетарский центр на Кавказе, для соз"
23,38,False,1.0,aleksandrov_1947,1947-1953,1947,-1.7059,-0.5728,"В Батуме Сталин развертывает кипучую революционную работу: устанавливает связи с передовыми рабочими, создает социал-демократические кружки, лично вед"
24,-1,True,0.0,aleksandrov_1947,1947-1953,1947,-1.4182,-0.8891,"Так, в этот период, в решительной и непримиримой борьбе с оппортунизмом сложилась и выросла ленинско-искровская организация в Закавказье. Ее виднейшим"
25,38,False,1.0,aleksandrov_1947,1947-1953,1947,-1.5088,-0.3856,Подъем борьбы рабочих в Батуме серьезно обеспокоил правительство. Полицейские ищейки усердно ищут «зачинщиков». 5 апреля 1902 года Сталина арестовываю
26,-1,True,0.0,aleksandrov_1947,1947-1953,1947,-1.7024,-0.395,"В начале марта 1903 года происходит первый съезд кавказских с.-д. организаций, на котором оформляется Кавказский союз РСДРП. Сталин, находившийся в за"
27,6,False,0.7593,aleksandrov_1947,1947-1953,1947,-3.5398,-1.2174,"Осенью 1903 года Сталина высылают на три года в Восточную Сибирь, в село Новая Уда Балаганского уезда Иркутской губернии. 27 ноября 1903 года Сталин п"
28,18,False,1.0,aleksandrov_1947,1947-1953,1947,-2.2159,0.3477,"Я находился тогда в Сибири в ссылке… Письмецо Ленина было сравнительно небольшое, но оно давало смелую, бесстрашную критику практики нашей партии и за"
29,38,False,1.0,aleksandrov_1947,1947-1953,1947,-1.4017,-0.3495,"В ссылке Сталин оставался недолго. Он рвался скорее на свободу, чтобы взяться за реализацию ленинского плана строительства большевистской партии. 5 ян"
30,19,False,0.8174,aleksandrov_1947,1947-1953,1947,-1.9804,-0.119,IIПочти два года Сталин пробыл в тюрьме и ссылке. Эти годы были годами - дальнейшего нарастания революционного подъема в стране. За это время состоялс
31,38,False,0.9839,aleksandrov_1947,1947-1953,1947,-1.8015,-0.5435,"Верной опорой Ленина в этой борьбе на Кавказе был Сталин, который стоял во главе закавказских большевиков. Работа Сталина в этот период проходит под ф"
32,-1,True,0.0,aleksandrov_1947,1947-1953,1947,-1.1473,-0.8669,"Под руководством Сталина и Джапаридзе в декабре 1904 г. проводилась грандиозная стачка бакинских рабочих, которая продолжалась с 13 по 31 декабря и за"
33,19,False,0.9567,aleksandrov_1947,1947-1953,1947,-2.019,-0.2832,"Сталин настойчиво проводит директивы Ленина, развивает и отстаивает большевистские идеи перед массами, организует борьбу за III съезд партии. Между Ле"
34,38,False,0.852,aleksandrov_1947,1947-1953,1947,-1.4996,-0.653,Замечательно смелым предприятием Кавказского союзного комитета РСДРП и выдающимся образцом большевистской подпольной техники была тайная Авлабарская т
35,-1,True,0.0,aleksandrov_1947,1947-1953,1947,-2.0024,-0.3706,"Решающая роль в деле защиты позиций большевизма на Кавказе, в пропаганде и развитии идей Ленина принадлежала выходившему под редакцией Сталина органу "
36,19,False,0.8628,aleksandrov_1947,1947-1953,1947,-2.2364,0.0747,В своих статьях и брошюрах Сталин разрабатывает ряд теоретических и политических вопросов. Он вскрывает идейную фальшь антибольшевистских течений и фр
37,-1,True,0.0,aleksandrov_1947,1947-1953,1947,-2.3641,2.0405,"Сталин, наиболее верный и до конца последовательный ученик и сподвижник Ленина, сыграл на Кавказе выдающуюся роль в идейном разгроме меньшевизма и защ"
38,18,False,1.0,aleksandrov_1947,1947-1953,1947,-2.4192,0.4337,"В своей замечательной брошюре «Коротко о партийных разногласиях», в двух «Письмах из Кутаиса» и в статье «Ответ “Социал-Демократу”» Сталин выступил с "
39,29,False,0.7186,aleksandrov_1947,1947-1953,1947,-3.5912,0.0241,"В «Письмах из Кутаиса» (сентябрь - октябрь 1904 года) Сталин дает резкую критику статей Плеханова в меньшевистской новой «Искре», направленных против "
40,29,False,0.7387,aleksandrov_1947,1947-1953,1947,-3.6393,-0.1221,"Развивая идеи в. И. Ленина, товарищ Сталин доказывает, что социалистическое сознание имеет великое значение для рабочего движения. Одновременно Сталин"
41,6,False,1.0,aleksandrov_1947,1947-1953,1947,-4.0687,-1.3131,Развертывая в брошюре «Коротко о партийных разногласиях» свою глубокую и разностороннюю аргументацию по вопросу о соотношении стихийного рабочего движ
42,6,False,1.0,aleksandrov_1947,1947-1953,1947,-4.1456,-1.2416,Вся история борьбы рабочего класса в России блестяще подтвердила этот важный теоретический вывод товарища Сталина. В этой брошюре Сталин дает уничтожа
43,18,False,1.0,aleksandrov_1947,1947-1953,1947,-2.4142,0.4815,"Выступление Сталина встретило полное одобрение Ленина. Оценивая статью Сталина «Ответ „Социал-Демократу“, напечатанную в „Пролетариатис Брдзола“ в авг"
44,6,False,1.0,aleksandrov_1947,1947-1953,1947,-3.9863,-1.3907,В ряде статей Сталин обосновывает ленинскую линию на II съезде РСДРП и после съезда. В статье «Класс пролетариев и партия пролетариев» (опубликована 1
45,18,False,1.0,aleksandrov_1947,1947-1953,1947,-2.6277,0.3056,Статья «Как понимает социал-демократия национальный вопрос?» (опубликована в No7 «Пролетариатис Брдзола» от 1 сентября 1904 г.) - замечательный коммен
46,-1,True,0.0,aleksandrov_1947,1947-1953,1947,-2.8822,-0.3225,"Имея в виду либералов, стремившихся не к революции, а к примирению с царем, Сталин еще накануне 9 января 1905 года говорил:«Да, господа, тщетны ваши с"
47,6,False,1.0,aleksandrov_1947,1947-1953,1947,-4.0166,-1.3297,"В его работах 1905 - 1907 годов дается всестороннее обоснование идеи вооруженного восстания. «Спасение народа в победоносном восстании самого народа»,"
48,6,False,1.0,aleksandrov_1947,1947-1953,1947,-4.0596,-1.3291,"Сталин обосновывает и развивает идею Ленина о временном революционном правительстве. Создание временного революционного правительства, указывает он, д"
49,34,False,0.9511,aleksandrov_1947,1947-1953,1947,-2.5178,-0.5119,"В борьбе с многочисленными врагами большевистской партии и рабочего класса Сталин последовательно отстаивает и развивает ленинскую теорию революции, л"
50,19,False,0.9119,aleksandrov_1947,1947-1953,1947,-2.0734,0.2395,"Кавказский союзный комитет неустанно пропагандировал решения III съезда партии, звал рабочих и крестьян к вооруженному восстанию. Сталинские листовки "
51,-1,True,0.0,aleksandrov_1947,1947-1953,1947,-2.2533,-0.2237,"Октябрьская всеобщая забастовка 1905 года, показавшая силу, мощь пролетарского движения, заставила насмерть перепуганного царя выступить с манифестом "
52,-1,True,0.0,aleksandrov_1947,1947-1953,1947,-1.7981,-0.4276,"Отстаивая мысль о необходимости для победы революции всенародного вооруженного восстания, Сталин в написанной им прокламации Тифлисского комитета Кавк"
53,19,False,0.9759,aleksandrov_1947,1947-1953,1947,-1.8558,-0.0947,В декабре 1905 года Сталин едет в качестве делегата от закавказских большевиков на первую Всероссийскую большевистскую конференцию в Таммерфорс (Финля
54,19,False,0.6021,aleksandrov_1947,1947-1953,1947,-2.2662,0.3646,"Сталин - активный участник IV съезда РСДРП (Стокгольм, апрель 1906 г.), на котором он вместе с Лениным отстаивал против меньшевиков большевистскую лин"
55,18,False,1.0,aleksandrov_1947,1947-1953,1947,-2.3437,0.5043,Вскоре после съезда Сталин написал брошюру «Современный момент и объединительный съезд рабочей партии». В этой брошюре Сталин дал анализ уроков декабр
56,38,False,1.0,aleksandrov_1947,1947-1953,1947,-1.7162,-0.67,После съезда Сталин вновь в Закавказье. Он ведет непримиримую борьбу против меньшевизма и других антипролетарских течений. Он руководит легальными бол
57,18,False,1.0,aleksandrov_1947,1947-1953,1947,-2.403,0.5249,"К этому времени относится серия замечательных статей Сталина - «Анархизм или социализм?», написанных в связи с активизацией в Закавказье анархистов-кр"
58,18,False,1.0,aleksandrov_1947,1947-1953,1947,-2.8741,0.2138,В защиту теоретических основ марксизма выступает и Сталин. В своих статьях «Анархизм или социализм?» Сталин отстаивает и развивает теоретические основ
59,18,False,1.0,aleksandrov_1947,1947-1953,1947,-2.7404,0.2067,С исключительной глубиной поставлены и решены в этой работе коренные вопросы марксистско-ленинской теории: неизбежность и неотвратимость социалистичес
60,-1,True,0.0,aleksandrov_1947,1947-1953,1947,-2.0668,0.4416,"В апреле - мае 1907 года состоялся V (Лондонский) съезд РСДРП, закрепивший победу большевиков над меньшевиками. Сталин - активный участник съезда. Вер"
61,19,False,0.7074,aleksandrov_1947,1947-1953,1947,-2.2043,-0.2251,"Для Ленина и Сталина это были годы непримиримой борьбы за сохранение и укрепление нелегальной революционной партии, за проведение большевистской линии"
62,38,False,1.0,aleksandrov_1947,1947-1953,1947,-1.7112,-0.6468,"С июня 1907 года начинается бакинский период революционной деятельности Сталина. Вернувшись с V (Лондонского) съезда РСДРП, Сталин оставляет Тифлис и "
63,19,False,1.0,aleksandrov_1947,1947-1953,1947,-1.9871,-0.0985,Сталин руководит кампанией по выборам рабочих депутатов в III Государственную думу. Написанный Сталиным «Наказ социал-демократическим депутатам III Го
64,6,False,0.423,aleksandrov_1947,1947-1953,1947,-3.1867,-1.161,"В мрачную ночь столыпинской реакции пролетарский Баку представляет невиданное зрелище: развертывается пролетарская борьба, на всю Россию гремит голос "
65,38,False,1.0,aleksandrov_1947,1947-1953,1947,-1.6939,-0.6043,"Сталин сплачивает вокруг себя крепкое ядро испытанных большевиков-ленинцев - Фиолетова, Саратовца (Ефимов), Вацека, Бокова, Малыгина, Орджоникидзе, Дж"
66,38,False,1.0,aleksandrov_1947,1947-1953,1947,-1.7007,-0.6709,Бакинский период имеет крупнейшее значение в жизни и деятельности Сталина. Вот что говорит Сталин об этом периоде:«Три года революционной работы среди
67,19,False,0.9119,aleksandrov_1947,1947-1953,1947,-1.96,0.008,"Сталин целиком поддерживает позицию Ленина, решительно выступает против ликвидаторов и отзовистов. В центральной партийной прессе появляются историчес"
68,-1,True,0.0,aleksandrov_1947,1947-1953,1947,-1.4026,-0.3117,Со второй половины 1911 года наступает петербургский период революционной деятельности товарища Сталина. 6 сентября 1911 года товарищ Сталин нелегальн
69,-1,True,0.0,aleksandrov_1947,1947-1953,1947,-2.9751,0.2682,"Большевики готовили такую партию, партию нового типа, уже со времен старой «Искры». Они готовили ее упорно, настойчиво, несмотря ни на что. Вся истори"
70,19,False,0.8174,aleksandrov_1947,1947-1953,1947,-1.9678,-0.1291,"IVПражская конференция предсказала в своих решениях неизбежность в недалеком будущем революционного подъема и приняла все меры для того, чтобы партия "
71,38,False,1.0,aleksandrov_1947,1947-1953,1947,-1.5741,-0.3325,И 29 февраля 1912 года Сталин вновь бежит из ссылки. За короткое время пребывания на «воле» Сталин развертывает энергичную деятельность: объезжает по 
72,-1,True,0.0,aleksandrov_1947,1947-1953,1947,-1.6086,-0.1278,Могучим оружием в руках большевистской партии в деле укрепления своих организаций и завоевания влияния в массах явилась ежедневная массовая большевист
73,19,False,0.8174,aleksandrov_1947,1947-1953,1947,-2.0676,-0.2646,В честь появления «Правды» было решено считать 5 мая днем праздника рабочей печати.«Правда» 1912 года - это закладка фундамента для победы большевизма
74,-1,True,0.0,aleksandrov_1947,1947-1953,1947,-1.9292,0.3267,"Крупнейшую роль в избирательной кампании, увенчавшейся победой партии, сыграл написанный Сталиным «Наказ петербургских рабочих своему рабочему депутат"
