idx,cluster,is_noise,probability,doc_id,period,year,x_2d,y_2d,text_preview
2592,52,False,1.0,tereshenko_2010,2000-2012,2010,0.7865,-2.0417,"8 мая 1942 г. немецкие войска, используя внезапность и неподготовленность Крымского фронта к обороне, мощным ударом вынудили его 12 мая оставить Керче"
2593,41,False,1.0,tereshenko_2010,2000-2012,2010,0.2366,-1.9783,По опыту укрепления Южного фронта осенью 1918 г. советское командование было вынуждено железной рукой террора против трусов и паникеров остановить бег
2594,41,False,1.0,tereshenko_2010,2000-2012,2010,0.3892,-1.7235,"Приказ требовал беспощадно пресекать разговоры о том, что мы якобы можем и должны отступать и дальше на восток, что от такого отступления вреда не буд"
2595,-1,True,0.0,tereshenko_2010,2000-2012,2010,-0.3097,-2.002,"Рубежом первого и второго периодов войны стал перелом в ходе Сталинградской битвы, переход от обороны к контрнаступлению Красной армии. Подготовка к н"
2596,52,False,1.0,tereshenko_2010,2000-2012,2010,0.697,-2.0557,М. Василевский - начальник Генерального штаба. Важнейшей частью этого плана стала стратегическая наступательная операция «Уран» - окружение противника
2597,16,False,0.38,tereshenko_2010,2000-2012,2010,1.397,0.4111,"8,5 млн. из них пало на поле боя, 2,5 млн. умерло от ран, 3,9 млн. погибло в фашистских концлагерях. В оккупации, в ходе обстрелов, бомбардировок, гол"
2598,44,False,0.5022,tereshenko_2010,2000-2012,2010,-1.2901,-2.2001,"24 мая 1945 г. в Кремле И. в. Сталин спросил командующих фронтами и руководителей вооруженных сил, как они смотрят на присвоение товарищу Сталину зван"
2599,64,False,0.7893,tereshenko_2010,2000-2012,2010,-0.8816,1.7954,"Брауншвейгского, А. в. Суворова. Впоследствии Молотов утверждал, будто Сталин жалел, что согласился на генералиссимуса, был против этого, но «перестар"
2600,41,False,1.0,tereshenko_2010,2000-2012,2010,0.6451,-1.1588,Впервые задачи по организации подполья и партизанской борьбы в тылу врага были определены в директиве СНК СССР и ЦК ВКП (б) от 29 июня 1941 г. Она тре
2601,3,False,1.0,tereshenko_2010,2000-2012,2010,0.7236,4.2611,Руководство страны оценило подвижничество церкви. Началась постепенная нормализация отношений между нею и государством. В стране прекратилась антирели
2602,9,False,1.0,tereshenko_2010,2000-2012,2010,-2.3509,4.1463,"Художественные фильмы создавались на киностудиях, эвакуированных в Алма-Ату, Ашхабад, Ташкент и Сталинабад. Военной теме были посвящены фильмы «Два бо"
2603,9,False,1.0,tereshenko_2010,2000-2012,2010,-2.3615,4.2255,"Эйзенштейна «Иван Грозный» (1-я серия). Фильм, снятый по личному указанию Сталина, прославлял победу русских на Волге и царя, превратившего Волгу в ве"
2604,16,False,0.8615,tereshenko_2010,2000-2012,2010,1.6075,0.3745,"Депортация народов. Особой и трагической страницей истории советского тыла военного периода стала депортация в отдаленные районы страны ряда народов, "
2605,16,False,1.0,tereshenko_2010,2000-2012,2010,1.7111,0.5525,"После освобождения Северного Кавказа были депортированы некоторые народы этого региона, отдельные представители которых действительно активно сотрудни"
2606,16,False,0.8615,tereshenko_2010,2000-2012,2010,1.6531,0.5098,"Депортации подверглись советские болгары, греки, турки-месхетинцы, курды - всего 14 наций и национальных групп общей численностью более 3,2 млн. челов"
2607,-1,True,0.0,tereshenko_2010,2000-2012,2010,0.5838,2.0082,"Впервые акция советского руководства, предпринятая в чрезвычайной обстановке военной поры, была осуждена в 1956 г. на XX съезде КПСС. В декабре 1989 г"
2608,51,False,0.8444,tereshenko_2010,2000-2012,2010,1.9754,-1.7626,Впервые этот вопрос был поставлен советским правительством в июле 1941 г. перед правительством Великобритании. В послании председателя СНК СССР И. В. 
2609,51,False,0.7888,tereshenko_2010,2000-2012,2010,2.5368,-1.4085,"Вопрос второго фронта стал важнейшим на Тегеранской конференции глав правительств СССР, США, Великобритании - И. в. Сталина, Ф. Рузвельта, У. Черчилля"
2610,51,False,1.0,tereshenko_2010,2000-2012,2010,2.0961,-1.7442,"Несмотря на очередную попытку Черчилля предотвратить высадку войск США и Англии во Франции, на конференции была достигнута договоренность о высадке со"
2611,51,False,0.8836,tereshenko_2010,2000-2012,2010,2.1892,-1.5983,Вопросы послевоенного устройства заняли важное место в повестке дня Тегеранской конференции (условное название «Эврика»). В принятой декларации главы 
2612,51,False,0.7857,tereshenko_2010,2000-2012,2010,2.2419,-1.6963,В Тегеране СССР добился от союзников принципиального согласия на передачу Советскому Союзу восточной части Пруссии - Кёнигсберга с прилегающими к нему
2613,51,False,0.9026,tereshenko_2010,2000-2012,2010,2.3114,-1.3096,Задачи послевоенного мирного устройства выдвинулись на первый план на Ялтинской и Потсдамской конференциях «Большой тройки». Ялтинская (Крымская) конф
2614,-1,True,0.0,tereshenko_2010,2000-2012,2010,1.7506,-0.6765,"Несмотря на неоднократные усилия, сопровождавшиеся реформированием национально-государственного устройства СССР (в 1944 г. в каждой союзной республике"
2615,51,False,1.0,tereshenko_2010,2000-2012,2010,2.472,-1.4324,Ареной острого противоборства по проблемам послевоенного мирного урегулирования стала Потсдамская (Берлинская) конференция «Большой тройки» (17 июля -
2616,-1,True,0.0,tereshenko_2010,2000-2012,2010,-2.2868,1.0975,"Особое значение речи заключалось в том, что она была произнесена не в узком кругу единомышленников, а публично и в присутствии президента США, который"
2617,33,False,1.0,tereshenko_2010,2000-2012,2010,2.2259,-0.7259,"Социалистический лагерь. Меры, предпринятые СССР, были адекватными мерам США, но менее эффективными. Силы были неравны, т. к. Советский Союз вышел из "
2618,51,False,0.9338,tereshenko_2010,2000-2012,2010,1.9134,-1.6278,"В июне 1948 г. в западных секторах Германии и Берлина была проведена сепаратная денежная реформа, которая угрожала дезорганизации экономики в советско"
2619,33,False,0.6817,tereshenko_2010,2000-2012,2010,1.8246,-0.3766,Начало раскола социалистического лагеря. Курс СССР на укрепление своих позиций в Европе не был последовательным. Стремление советского руководства к б
2620,33,False,0.6817,tereshenko_2010,2000-2012,2010,1.9373,-0.4444,"В октябре 1949 г. между СССР и Югославией были разорваны дипломатические отношения, прекращены межпартийные связи. Это имело далеко идущие последствия"
2621,5,False,0.3604,tereshenko_2010,2000-2012,2010,-3.93,2.8218,"Корейская война. Осью противостояния двух систем в эпоху «холодной войны» было советско-американское противоборство, острота которого и определяла кли"
2622,51,False,1.0,tereshenko_2010,2000-2012,2010,2.0664,-1.7733,"СССР снабжал корейскую народную армию и «китайских добровольцев» оружием, боеприпасами, транспортом, горючим, продовольствием, медикаментами. Он подго"
2623,32,False,1.0,tereshenko_2010,2000-2012,2010,2.3971,-1.0468,"В 1951 г. президент США Г. Трумэн заявил о возможном использовании ядерного оружия против Китая, который был объявлен агрессором за участие в войне на"
2624,56,False,1.0,tereshenko_2010,2000-2012,2010,-5.0389,1.4397,К восстановлению экономики приступили еще в 1943 г. по мере изгнания оккупантов. Но восстановительный период начался в 1946 г. К этому времени Госплан
2625,30,False,0.6008,tereshenko_2010,2000-2012,2010,-5.7908,0.5381,"Сельское хозяйство. В отличие от 20-х годов, в послевоенные годы правительство во главе со Сталиным восстановление экономики начало не с сельского хоз"
2626,63,False,0.8961,tereshenko_2010,2000-2012,2010,-0.6636,2.0158,"Сердце не выдержало гнева Сталина на его сына Ю. А. Жданова, заведующего агитационно-пропагандистским отделом ЦК ВКП (б), организатора «похода на Лысе"
2627,30,False,0.7127,tereshenko_2010,2000-2012,2010,-6.1228,0.4082,"Не способствовало укреплению сельского хозяйства и раскулачивание, проведенное на рубеже 40-х - 50-х годов в западных областях Украины, Белоруссии, ре"
2628,-1,True,0.0,tereshenko_2010,2000-2012,2010,-4.5961,1.4205,"Сталин обосновывал политику снижения цен тем, что она является надежным путем увеличения реальной зарплаты и кнутом для промышленности. Подобно конкур"
2629,5,False,1.0,tereshenko_2010,2000-2012,2010,-4.2025,3.1189,"Общественно-политическое развитие. В послевоенные годы, как и в 30-е, в советском обществе переплелись два противоречивых курса: формальная демократиз"
2630,-1,True,0.0,tereshenko_2010,2000-2012,2010,-0.8381,2.1862,"Сессия приняла закон о преобразовании Совета Народных Комиссаров в Совет Министров, что соответствовало общепринятым в мировой государственной практик"
2631,-1,True,0.0,tereshenko_2010,2000-2012,2010,-4.2181,1.194,Сессия Верховного Совета СССР утвердила ранее одобренный ЦК партии 4-й пятилетний план восстановления и развития народного хозяйства СССР на 1946-1950
2632,-1,True,0.0,tereshenko_2010,2000-2012,2010,-2.8976,1.1203,"Наконец, в октябре 1952 г. состоялся XIX съезд партии, последний, на котором присутствовал Сталин. Он принял решение переименовать ВКП (б) в Коммунист"
2633,63,False,1.0,tereshenko_2010,2000-2012,2010,-0.9746,2.0682,"В составе Президиума было создано узкое бюро из 7 человек (Сталин, Берия, Булганин, Каганович, Маленков, Сабуров и Хрущев). Сталин был избран секретар"
2634,11,False,1.0,tereshenko_2010,2000-2012,2010,-2.9697,3.4468,В 1950-1951 гг. по инициативе Сталина и с его личным участием состоялись первые послевоенные научные дискуссии по проблемам языкознания и политэкономи
2635,10,False,0.7493,tereshenko_2010,2000-2012,2010,-2.7685,3.0832,"Предельно политизируя научные проблемы, доводя критику до криминальных характеристик, Сталин обвинил всемирно известного лингвиста, археолога и академ"
2636,-1,True,0.0,tereshenko_2010,2000-2012,2010,-2.712,3.2147,"В феврале 1952 г. Сталин откликнулся на прошедшую дискуссию статьей «Замечания по экономическим вопросам, связанные с ноябрьской дискуссией 1951 г.». "
2637,11,False,0.5834,tereshenko_2010,2000-2012,2010,-2.746,3.4576,"Она стала последней теоретической работой, которую историки назвали теоретическим завещанием И. в. Сталина. Книга была выдержана в духе партийной прог"
2638,-1,True,0.0,tereshenko_2010,2000-2012,2010,-2.7789,2.9486,Усиление репрессивной роли государства проявилось в послевоенных идеологических кампаниях и репрессиях 1949 г. - начала 1953 г. В первые послевоенные 
2639,9,False,0.5397,tereshenko_2010,2000-2012,2010,-2.2292,3.7037,"Руководство СССР взяло курс на немедленное «завинчивание гаек» в отношении интеллигенции, которые ослабли в военные годы. С этой целью в 1946-1948 гг."
2640,9,False,0.7252,tereshenko_2010,2000-2012,2010,-2.4604,3.3594,"Постановления были призваны сломать настроения аполитичности и безыдейности, желания просто хорошо жить, отдыхать, зарабатывать, свободно дышать. Они "
2641,-1,True,0.0,tereshenko_2010,2000-2012,2010,-0.961,2.1078,"Сталин подозревал, что с помощью советских интеллигентов еврейской национальности американцы хотят взорвать изнутри политический режим ССср. Он усматр"
2642,15,False,0.9061,tereshenko_2010,2000-2012,2010,-0.1354,1.5015,"После поездки в США (1943 г.) 15 февраля 1944 г. Михоэлс при участии Лозовского составил в адрес Сталина письмо, в котором изложил пожелание американс"
2643,23,False,1.0,tereshenko_2010,2000-2012,2010,0.6101,1.707,"Лозовский. В мае-июле 1952 г. Военная коллегия Верховного Суда СССР рассмотрела «дело ЕАК» и приговорила 13 человек к расстрелу, а Л. С. Штерн (академ"
2644,23,False,0.7904,tereshenko_2010,2000-2012,2010,0.3664,1.7247,«Ленинградское дело» формально было начато в январе 1949 г. после поступления в ЦК ВКП (б) анонимки о подтасовке результатов выборов секретарей Ленинг
2645,23,False,0.7526,tereshenko_2010,2000-2012,2010,0.3615,1.8811,Ф. Капустин - второй секретарь Ленинградского горкома партии; П. г. Лазутин - председатель Ленинградского горисполкома. 1 октября 1950 г. Военная колл
2646,-1,True,0.0,tereshenko_2010,2000-2012,2010,-0.704,2.3349,"Следует сказать, что в 1948 г. Сталин рассматривал Вознесенского и Кузнецова в качестве своих преемников на постах соответственно главы правительства "
2647,-1,True,0.0,tereshenko_2010,2000-2012,2010,0.5843,1.0655,"Жертвами репрессий стали все руководители Ленинградской областной и городской партийных организаций, руководители районных партийных организаций Ленин"
2648,23,False,0.7908,tereshenko_2010,2000-2012,2010,0.143,1.783,Репрессии прокатились и по другим республикам. В ноябре 1951 г. и в марте 1952 г. ЦК ВКП (б) принял два постановления по т. н. «мингрельскому делу». С
2649,-1,True,0.0,tereshenko_2010,2000-2012,2010,-0.1232,2.9546,"В ноябре 1952 г. развернулось «дело врачей». Были арестованы начальник лечебно-санитарного управления Кремля П. И. Егоров, профессора в. Н. Виноградов"
2650,66,False,1.0,tereshenko_2010,2000-2012,2010,-0.64,2.9199,"Смерть И. в. Сталина и борьба наследников за власть. 5 марта 1953 г. на 74-м году жизни умер И. в. Сталин. Смерть человека, который 30 лет стоял на ве"
2651,51,False,0.6081,tereshenko_2010,2000-2012,2010,-2.1126,1.7358,"Оно с трудом и робко вступало в новый период своего развития. В 1959 г. вспоминая своего фронтового товарища и политического противника, У. Черчилль н"
2652,66,False,1.0,tereshenko_2010,2000-2012,2010,-0.7468,2.9193,"И. В. Сталин был похоронен на Красной площади в Мавзолее рядом с В. И. Лениным. «Великая могила» соединила учителя и ученика, который пошел дальше и д"
2653,67,False,0.9726,tereshenko_2010,2000-2012,2010,-0.8713,2.3092,Наследники Сталина договорились осуществлять руководство страной и партией коллективно. Однако до июля 1953 г. вся фактическая полнота власти в стране
2654,21,False,1.0,tereshenko_2010,2000-2012,2010,-0.2127,1.9521,"По инициативе Берия было прекращено «дело врачей», объявлена широкая амнистия заключенных. Он же стремился лишить ЦК партии права руководить экономико"
2655,51,False,0.6054,tereshenko_2010,2000-2012,2010,1.5587,-1.2375,17 июня 1953 г. Берия лично возглавил вооруженное подавление массовых беспорядков в Берлине и других районах ГДР. Они были спровоцированы западногерма
2656,51,False,0.658,tereshenko_2010,2000-2012,2010,2.0373,-1.1811,"Вернувшись в Москву, Берия на Президиуме ЦК настаивал на том, чтобы перестать «болтать о социализме» в ГДР, отказаться от ее поддержки, согласиться на"
2657,21,False,1.0,tereshenko_2010,2000-2012,2010,-0.0007,2.0774,"2-7 июля 1953 г. пленум ЦК КПСС на основании доклада Маленкова вывел Берия из своих рядов, затем исключил из партии «как врага Коммунистической партии"
2658,23,False,0.8955,tereshenko_2010,2000-2012,2010,0.5102,1.831,"В декабре 1953 г. состоялись закрытый суд и казнь 7 «врагов народа» - Берия и его ближайших сподвижников, разжалованных генералов в. Н. Меркулова (быв"
2659,23,False,0.7819,tereshenko_2010,2000-2012,2010,0.3891,1.4447,Их обвинили в организации массовых репрессий в годы жизни Сталина и подготовке государственного переворота после его смерти и приговорили к высшей мер
2660,39,False,1.0,tereshenko_2010,2000-2012,2010,-3.9139,2.3764,Реформы не были подкреплены последовательной демократизацией политической системы. Это стало главной причиной их поражения. Сломав сложившуюся в 1930-
2661,23,False,0.8029,tereshenko_2010,2000-2012,2010,0.7136,1.5239,"24 человека было убито, 70 ранено. 105 активных участников демонстрации протеста были осуждены, из них 7 организаторов - к высшей мере наказания (расс"
2662,-1,True,0.0,tereshenko_2010,2000-2012,2010,-4.8581,1.8158,"Технический прогресс в условиях плановой экономики требовал концентрации сил и средств на главном направлении, которое предстояло определить. После см"
2663,6,False,1.0,tereshenko_2010,2000-2012,2010,-3.4682,-0.9971,"- В декабре 1922 г. Ленин предложил очередному съезду партии обдумать способ перемещения Сталина с поста генсека, поскольку он слишком груб."
2664,6,False,1.0,tereshenko_2010,2000-2012,2010,-3.5003,-0.9574,"- Сталин первое время после кончины Ленина считался с его указаниями, а затем стал ими пренебрегать, проявляя полную нетерпимость к коллективному руко"
2665,6,False,0.7919,tereshenko_2010,2000-2012,2010,-3.3318,-0.7902,"- Сталин сыграл положительную роль в борьбе с троцкистами, правыми уклонистами, буржуазными националистами, в которой партия окрепла и закалилась."
2666,6,False,1.0,tereshenko_2010,2000-2012,2010,-3.3598,-0.8579,"- Сталин отбросил ленинский метод убеждения и воспитания, ввел понятие «враг народа» и практику массовых репрессий по государственной линии сначала пр"
2667,-1,True,0.0,tereshenko_2010,2000-2012,2010,-1.0953,1.7056,"- Культ личности нанес ущерб партии особенно после XVII съезда партии и злодейского убийства С. М. Кирова. 70 % членов и кандидатов ЦК, избранных на X"
